{
  "$schema": "https://raw.githubusercontent.com/madbrolab/dian115/main/docs/plugin-platform/signature.schema.json",
  "schema_version": 1,
  "algorithm": "Ed25519",
  "canonicalization": "RFC8785-JCS",
  "domain": "DIAN115-PLUGIN-PACKAGE-V1",
  "key_id": "ed25519:OnYspKQoIPHqMo0cy8ghslwqWg3693JjTLNDfEaVaXs",
  "public_key": "rXR0Myj-Hfzh-fiTWgfDFtSR52ir43J19ki-8lTH0UQ",
  "signature": "cnB_RHjAR-Z93Hp6wxt7iUwl7Jnp-SiA-q3gxlJ5H9YUv7X1NSN71djeHouGiq1rLJ4OrTlBJEZfluldZGirBw"
}
